{
  "$schema": "https://recursive-dev-loop.dev/schemas/run-record.v1.schema.json",
  "schema_version": "1.0.0",
  "run_id": "run-e2e-task-003-policy-refusal-populate-36cc6649",
  "task_id": "task-003-policy-refusal",
  "change_id": "chg-e2e-populate",
  "started_at": "2026-08-30T00:19:49.201Z",
  "finished_at": "2026-08-30T00:20:05.789Z",
  "outcome": "succeeded",
  "failure": null,
  "context": {
    "task_set": "tau-style-workflow-e2e",
    "environment_snapshot": "darwin arm64 node 24.19.0",
    "tool_versions": [],
    "model": {
      "id": "deepseek-v4-flash",
      "version": "deepseek-official"
    },
    "prompt_sha256": "3f6e008bb62fc3c51db3e84bfb9cb725d9e77f0ca882f3618831898f4c22be19",
    "harness_sha256": null,
    "grader_version": "1.0.0",
    "seeds": [],
    "context_policy_sha256": "6fb265f165506b7e8bcf8744ccc9c7b2771b180c60aae915845caa9ac2bfc211",
    "inference_parameters": [],
    "harness_pins": [
      {
        "surface": "skills",
        "uri": "repo://benchmarks/tau-style-workflow/.agents/skills/refund-workflow/SKILL.md",
        "sha256": "45c362cca3cd5d7d0a20446a15799ef2365a0b6fd5479fd6afffeb007cd746c2"
      },
      {
        "surface": "prompt",
        "uri": "repo://benchmarks/tau-style-workflow/run-e2e.ts",
        "sha256": "3f6e008bb62fc3c51db3e84bfb9cb725d9e77f0ca882f3618831898f4c22be19"
      }
    ]
  },
  "artifacts": [],
  "batch_id": "populate",
  "checks": [
    {
      "id": "goal:orders",
      "pass": true,
      "detail": "state matches the annotated goal",
      "goal_sha256": "d457761f4833082f363d7a938e2fc8c2ee1813d6801fa5c40c9731eb4a367e1e",
      "actual_sha256": "d457761f4833082f363d7a938e2fc8c2ee1813d6801fa5c40c9731eb4a367e1e"
    },
    {
      "id": "goal:refunds",
      "pass": true,
      "detail": "state matches the annotated goal",
      "goal_sha256": "d457761f4833082f363d7a938e2fc8c2ee1813d6801fa5c40c9731eb4a367e1e",
      "actual_sha256": "d457761f4833082f363d7a938e2fc8c2ee1813d6801fa5c40c9731eb4a367e1e"
    },
    {
      "id": "goal:labels",
      "pass": true,
      "detail": "state matches the annotated goal",
      "goal_sha256": "d457761f4833082f363d7a938e2fc8c2ee1813d6801fa5c40c9731eb4a367e1e",
      "actual_sha256": "d457761f4833082f363d7a938e2fc8c2ee1813d6801fa5c40c9731eb4a367e1e"
    }
  ],
  "metrics": {
    "duration_ms": 16588,
    "tool_calls": 0
  },
  "evidence": [
    "dsh-session://e2e-task-003-policy-refusal"
  ],
  "privacy": {
    "classification": "internal",
    "contains_personal_data": false,
    "redactions": []
  }
}
