{
  "$schema": "https://recursive-dev-loop.dev/schemas/run-record.v1.schema.json",
  "schema_version": "1.0.0",
  "run_id": "run-e2e-task-003-policy-refusal-g2-7cc4335f",
  "task_id": "task-003-policy-refusal",
  "change_id": "chg-e2e-g2",
  "started_at": "2026-08-31T00:28:59.670Z",
  "finished_at": "2026-08-31T00:30:27.268Z",
  "outcome": "succeeded",
  "failure": null,
  "context": {
    "task_set": "tau-style-workflow-e2e",
    "environment_snapshot": "darwin arm64 node 24.19.0",
    "tool_versions": [],
    "model": {
      "id": "deepseek-v4-flash",
      "version": "deepseek-official"
    },
    "prompt_sha256": "f52cc83cc4008cd1db9d2fa0f4b446129aba2d7d84ef79a10be1b3a378a24c54",
    "harness_sha256": null,
    "grader_version": "1.0.0",
    "seeds": [],
    "context_policy_sha256": "6fb265f165506b7e8bcf8744ccc9c7b2771b180c60aae915845caa9ac2bfc211",
    "inference_parameters": [],
    "harness_pins": [
      {
        "surface": "skills",
        "uri": "repo://benchmarks/tau-style-workflow/.agents/skills/refund-workflow/SKILL.md",
        "sha256": "715ea6a4702f78450a93fe934627c1823db31b7b43981f1cf70a9847dde078a2"
      },
      {
        "surface": "prompt",
        "uri": "repo://benchmarks/tau-style-workflow/run-e2e.ts",
        "sha256": "f52cc83cc4008cd1db9d2fa0f4b446129aba2d7d84ef79a10be1b3a378a24c54"
      },
      {
        "surface": "model_patch",
        "uri": "repo://benchmarks/tau-style-workflow/.dal/benchmark/e2e/model-patch.yml",
        "sha256": "249b32b8f5b53bdefc03e111f6ca37dfe5a8dce0971b63f81b76ba5f6b65fee0"
      }
    ],
    "model_patch_sha256": "249b32b8f5b53bdefc03e111f6ca37dfe5a8dce0971b63f81b76ba5f6b65fee0"
  },
  "artifacts": [],
  "batch_id": "g2",
  "checks": [
    {
      "id": "goal:orders",
      "pass": true,
      "detail": "state matches the annotated goal",
      "goal_sha256": "d457761f4833082f363d7a938e2fc8c2ee1813d6801fa5c40c9731eb4a367e1e",
      "actual_sha256": "4862ed8e8a71fcfe430d6bf64b556bac4106294301b99d7f8d74a27546ee86a4"
    },
    {
      "id": "goal:refunds",
      "pass": true,
      "detail": "state matches the annotated goal",
      "goal_sha256": "d457761f4833082f363d7a938e2fc8c2ee1813d6801fa5c40c9731eb4a367e1e",
      "actual_sha256": "4862ed8e8a71fcfe430d6bf64b556bac4106294301b99d7f8d74a27546ee86a4"
    },
    {
      "id": "goal:labels",
      "pass": true,
      "detail": "state matches the annotated goal",
      "goal_sha256": "d457761f4833082f363d7a938e2fc8c2ee1813d6801fa5c40c9731eb4a367e1e",
      "actual_sha256": "4862ed8e8a71fcfe430d6bf64b556bac4106294301b99d7f8d74a27546ee86a4"
    }
  ],
  "business_outcome": {
    "status": "passed",
    "source": "repo://benchmarks/tau-style-workflow/grader/grade.ts",
    "score": 1,
    "earned": 3,
    "total": 3
  },
  "metrics": {
    "duration_ms": 87598,
    "tool_calls": 0
  },
  "evidence": [
    "dsh-session://e2e-task-003-policy-refusal",
    "repo://.dal/check/e2e-receipts/rcp-task-003-policy-refusal-f3679ce7.json"
  ],
  "privacy": {
    "classification": "internal",
    "contains_personal_data": false,
    "redactions": []
  }
}
