{
  "$schema": "https://recursive-dev-loop.dev/schemas/run-record.v1.schema.json",
  "schema_version": "1.0.0",
  "run_id": "run-e2e-task-004-partial-refund-g2-49ddcda2",
  "task_id": "task-004-partial-refund",
  "change_id": "chg-e2e-g2",
  "started_at": "2026-08-31T00:30:27.286Z",
  "finished_at": "2026-08-31T00:34:31.027Z",
  "outcome": "succeeded",
  "failure": null,
  "context": {
    "task_set": "tau-style-workflow-e2e",
    "environment_snapshot": "darwin arm64 node 24.19.0",
    "tool_versions": [],
    "model": {
      "id": "deepseek-v4-flash",
      "version": "deepseek-official"
    },
    "prompt_sha256": "989fa8a71717603f596590f03753de4966018f76d80c0d136783e769a29feaaa",
    "harness_sha256": null,
    "grader_version": "1.0.0",
    "seeds": [],
    "context_policy_sha256": "6fb265f165506b7e8bcf8744ccc9c7b2771b180c60aae915845caa9ac2bfc211",
    "inference_parameters": [],
    "harness_pins": [
      {
        "surface": "skills",
        "uri": "repo://benchmarks/tau-style-workflow/.agents/skills/refund-workflow/SKILL.md",
        "sha256": "715ea6a4702f78450a93fe934627c1823db31b7b43981f1cf70a9847dde078a2"
      },
      {
        "surface": "prompt",
        "uri": "repo://benchmarks/tau-style-workflow/run-e2e.ts",
        "sha256": "989fa8a71717603f596590f03753de4966018f76d80c0d136783e769a29feaaa"
      },
      {
        "surface": "model_patch",
        "uri": "repo://benchmarks/tau-style-workflow/.dal/benchmark/e2e/model-patch.yml",
        "sha256": "249b32b8f5b53bdefc03e111f6ca37dfe5a8dce0971b63f81b76ba5f6b65fee0"
      }
    ],
    "model_patch_sha256": "249b32b8f5b53bdefc03e111f6ca37dfe5a8dce0971b63f81b76ba5f6b65fee0"
  },
  "artifacts": [],
  "batch_id": "g2",
  "checks": [
    {
      "id": "goal:orders",
      "pass": true,
      "detail": "state matches the annotated goal",
      "goal_sha256": "29245c4e59b6b27e256030779712fe39f8ba7cd11964266034ff0a5c40f24726",
      "actual_sha256": "d350db1124c1f869ded35daa1f5f6b9df621c699cdffab34293ca4acfb89909f"
    },
    {
      "id": "goal:refunds",
      "pass": true,
      "detail": "state matches the annotated goal",
      "goal_sha256": "29245c4e59b6b27e256030779712fe39f8ba7cd11964266034ff0a5c40f24726",
      "actual_sha256": "d350db1124c1f869ded35daa1f5f6b9df621c699cdffab34293ca4acfb89909f"
    },
    {
      "id": "goal:labels",
      "pass": true,
      "detail": "state matches the annotated goal",
      "goal_sha256": "29245c4e59b6b27e256030779712fe39f8ba7cd11964266034ff0a5c40f24726",
      "actual_sha256": "d350db1124c1f869ded35daa1f5f6b9df621c699cdffab34293ca4acfb89909f"
    }
  ],
  "business_outcome": {
    "status": "passed",
    "source": "repo://benchmarks/tau-style-workflow/grader/grade.ts",
    "score": 1,
    "earned": 3,
    "total": 3
  },
  "metrics": {
    "duration_ms": 243741,
    "tool_calls": 0
  },
  "evidence": [
    "dsh-session://e2e-task-004-partial-refund",
    "repo://.dal/check/e2e-receipts/rcp-task-004-partial-refund-e7a3dc67.json"
  ],
  "privacy": {
    "classification": "internal",
    "contains_personal_data": false,
    "redactions": []
  }
}
