{
  "$schema": "https://recursive-dev-loop.dev/schemas/run-record.v1.schema.json",
  "schema_version": "1.0.0",
  "run_id": "run-fixture-succeeded",
  "task_id": "guardrail regression run",
  "change_id": "chg-fixture-example",
  "started_at": "2026-08-28T01:15:00.000Z",
  "finished_at": "2026-08-28T01:15:18.000Z",
  "outcome": "succeeded",
  "record_stage": "final",
  "failure": null,
  "context": {
    "task_set": "held-in",
    "environment_snapshot": "local-node24-macos",
    "tool_versions": [
      { "name": "node", "version": "24.19.0" },
      { "name": "pnpm", "version": "11.7.0" }
    ],
    "model": { "id": "deepseek-v4-pro", "version": "2026-08" },
    "prompt_sha256": "1111111111111111111111111111111111111111111111111111111111111111",
    "harness_sha256": "2222222222222222222222222222222222222222222222222222222222222222",
    "grader_version": "1.0.0",
    "seeds": [8],
    "context_policy_sha256": "3333333333333333333333333333333333333333333333333333333333333333",
    "inference_parameters": [{ "name": "temperature", "value": "0.2" }],
    "candidate_generation": {
      "candidate_id": "cand-fixture-001",
      "candidate_sha256": "5555555555555555555555555555555555555555555555555555555555555555",
      "start_hmr_sequence": 7,
      "end_hmr_sequence": 7,
      "evaluation_eligible": true,
      "git_tree": "6666666666666666666666666666666666666666",
      "dsh_version": "0.1.1-rc.2",
      "profile": "hmr-test"
    }
  },
  "artifacts": [
    {
      "uri": "repo://src/guardrail.ts",
      "sha256": "4444444444444444444444444444444444444444444444444444444444444444",
      "description": "Candidate harness change under evaluation"
    }
  ],
  "metrics": { "duration_ms": 18000, "tool_calls": 6 },
  "evidence": ["repo://tests/fixtures/feedback/completed.json"],
  "privacy": {
    "classification": "internal",
    "contains_personal_data": false,
    "redactions": []
  }
}
