{
  "$schema": "https://recursive-dev-loop.dev/schemas/run-record.v1.schema.json",
  "schema_version": "1.0.0",
  "run_id": "run-e2e-task-001-refund-baseline-365dce2b",
  "task_id": "task-001-refund",
  "change_id": "chg-e2e-baseline",
  "started_at": "2026-08-29T23:30:42.508Z",
  "finished_at": "2026-08-29T23:31:00.457Z",
  "outcome": "succeeded",
  "failure": null,
  "context": {
    "task_set": "tau-style-workflow-e2e",
    "environment_snapshot": "darwin arm64 node 24.19.0",
    "tool_versions": [],
    "model": {
      "id": "deepseek-v4-flash",
      "version": "deepseek-official"
    },
    "prompt_sha256": "db8d57d4649899df477899310cac9a34b4c2846d9563ca625b6d03c0ddeb421e",
    "harness_sha256": null,
    "grader_version": "1.0.0",
    "seeds": [],
    "context_policy_sha256": "6fb265f165506b7e8bcf8744ccc9c7b2771b180c60aae915845caa9ac2bfc211",
    "inference_parameters": []
  },
  "artifacts": [],
  "metrics": {
    "duration_ms": 17948,
    "tool_calls": 0
  },
  "evidence": [
    "dsh-session://e2e-task-001-refund"
  ],
  "privacy": {
    "classification": "internal",
    "contains_personal_data": false,
    "redactions": []
  }
}
