{
  "$schema": "https://recursive-dev-loop.dev/schemas/run-record.v1.schema.json",
  "schema_version": "1.0.0",
  "run_id": "run-e2e-task-005-booking-refusal-g2-eb6a2a1b",
  "task_id": "task-005-booking-refusal",
  "change_id": "chg-e2e-g2",
  "started_at": "2026-08-31T00:34:31.040Z",
  "finished_at": "2026-08-31T00:37:17.118Z",
  "outcome": "succeeded",
  "failure": null,
  "context": {
    "task_set": "tau-style-workflow-e2e",
    "environment_snapshot": "darwin arm64 node 24.19.0",
    "tool_versions": [],
    "model": {
      "id": "deepseek-v4-flash",
      "version": "deepseek-official"
    },
    "prompt_sha256": "5fb24a4e9c7c14bd25d69d3cb404fc5c6c8a9eec9ad12ca3636fbe98d9cde8c7",
    "harness_sha256": null,
    "grader_version": "1.0.0",
    "seeds": [],
    "context_policy_sha256": "6fb265f165506b7e8bcf8744ccc9c7b2771b180c60aae915845caa9ac2bfc211",
    "inference_parameters": [],
    "harness_pins": [
      {
        "surface": "skills",
        "uri": "repo://benchmarks/tau-style-workflow/.agents/skills/refund-workflow/SKILL.md",
        "sha256": "715ea6a4702f78450a93fe934627c1823db31b7b43981f1cf70a9847dde078a2"
      },
      {
        "surface": "prompt",
        "uri": "repo://benchmarks/tau-style-workflow/run-e2e.ts",
        "sha256": "5fb24a4e9c7c14bd25d69d3cb404fc5c6c8a9eec9ad12ca3636fbe98d9cde8c7"
      },
      {
        "surface": "model_patch",
        "uri": "repo://benchmarks/tau-style-workflow/.dal/benchmark/e2e/model-patch.yml",
        "sha256": "249b32b8f5b53bdefc03e111f6ca37dfe5a8dce0971b63f81b76ba5f6b65fee0"
      }
    ],
    "model_patch_sha256": "249b32b8f5b53bdefc03e111f6ca37dfe5a8dce0971b63f81b76ba5f6b65fee0"
  },
  "artifacts": [],
  "batch_id": "g2",
  "checks": [
    {
      "id": "goal:bookings",
      "pass": true,
      "detail": "state matches the annotated goal",
      "goal_sha256": "8f029b5f5b2ba482025da563ad030b899c10b955825321cb20b58795bfb9e54d",
      "actual_sha256": "2d590e340cfbd70c334aebca511b887c855ce0e554d22a7e0fadfe98f64ed645"
    }
  ],
  "business_outcome": {
    "status": "passed",
    "source": "repo://benchmarks/tau-style-workflow/grader/grade.ts",
    "score": 1,
    "earned": 1,
    "total": 1
  },
  "metrics": {
    "duration_ms": 166078,
    "tool_calls": 0
  },
  "evidence": [
    "dsh-session://e2e-task-005-booking-refusal",
    "repo://.dal/check/e2e-receipts/rcp-task-005-booking-refusal-91e9d835.json"
  ],
  "privacy": {
    "classification": "internal",
    "contains_personal_data": false,
    "redactions": []
  }
}
